title,vote_average,vote_count,release_date,revenue,overview,poster_path,youtubeId
Sleepaway Camp,6.3,594,1983-11-18,11000000,"Slightly disturbed and painfully shy Angela Baker is sent away to summer camp with her cousin. Not long after Angela's arrival, things start to go horribly wrong for anyone with sinister or less than honorable intentions.",/fz9HeN5DzZgDVPZrpmeGORrZPR1.jpg,yfZR1Lqjws4
Ice Age: A Mammoth Christmas,6.413,589,2011-11-24,0,"When Sid accidentally destroys Manny's heirloom Christmas rock and ends up on Santa's naughty list, he leads a hilarious quest to the North Pole to make things right and ends up making things much worse. Now it's up to Manny and his prehistoric posse to band together and save Christmas for the entire world!",/kwLi6MLlVsPWMVB9gOpFo5n7HZR.jpg,Dk1XJF2SX4E
No Good Deed,5.949,588,2014-09-10,53830415,"Terri is a devoted wife and mother of two, living an ideal suburban life in Atlanta when Colin, a charming but dangerous escaped convict, shows up at her door claiming car trouble. Terri offers her phone to help him but soon learns that no good deed goes unpunished as she finds herself fighting for survival when he invades her home and terrorizes her family.",/wcDLqCS70LsPcovieuQrb311Qr1.jpg,G5VeowxERwM
Hatchet,5.784,586,2006-04-27,155873,"When a group of tourists on a New Orleans haunted swamp tour find themselves stranded in the wilderness, their evening of fun and spooks turns into a horrific nightmare.",/xRWRUZchxjttsNkGVZD2zGpihbJ.jpg,3C33S_cqiJ8
Superman/Batman: Public Enemies,7.032,586,2009-09-29,0,"United States President Lex Luthor uses the oncoming trajectory of a Kryptonite meteor to frame Superman and declare a $1 billion bounty on the heads of the Man of Steel and his ‘partner in crime’, Batman. Heroes and villains alike launch a relentless pursuit of Superman and Batman, who must unite—and recruit help—to try and stave off the action-packed onslaught, stop the meteor Luthors plot.",/izvMc22ywSLFWUXZEIuJJ8dms75.jpg,pKN2AToJ84g
Cats & Dogs: The Revenge of Kitty Galore,5.188,582,2010-07-29,112483764,The ongoing war between the canine and feline species is put on hold when they join forces to thwart a rogue cat spy with her own sinister plans for conquest.,/nTsZT66I4U3aS9ezLdOKacfvo8T.jpg,jK6suPB_vTk
Getaway,5.044,580,2013-08-29,10501938,"Former race car driver Brent Magna is pitted against the clock. Desperately trying to save the life of his kidnapped wife, Brent commandeers a custom Ford Shelby GT500 Super Snake, taking it and its unwitting owner on a high-speed race against time, at the command of the mysterious villain holding his wife hostage.",/z4sEWm1ykf9WX5WJU4XMD4oI5sI.jpg,hM7BB16PkAw
Because I Said So,5.936,577,2007-02-02,69485490,"In an effort to prevent family history from repeating itself, meddlesome mom Daphne Wilder attempts to set up her youngest daughter, Milly, with Mr. Right. Meanwhile, her other daughters try to keep their mom's good intentions under control.",/wQtGQnr5RPnmzSfV9zUcgh8R9NX.jpg,aUE8gHEPJ_I
Agent Cody Banks 2: Destination London,5.525,577,2004-03-12,28818995,"With all-new gadgets, high-flying action, exciting chases and a wisecracking new handler, Derek (Anthony Anderson), Cody has to retrieve the device before the world's leaders fall under the evil control of a diabolical villain.",/l5CCDJV0VojPJedNcucPWBnrGaC.jpg,3t-pTVmIHqg
Deck the Halls,5.47,577,2006-11-22,47231070,"Determined to unseat Steve Finch's reign as the town's holiday season king, Buddy Hall plasters his house with so many decorative lights that it'll be visible from space! When their wives bond, and their kids follow suit, the two men only escalate their rivalry - and their decorating.",/muRplVEe8xU1jVlq9WpQSOamb6s.jpg,3EmhpFFGrxk
North Country,7.223,574,2005-02-12,25224242,"A fictionalized account of the first major successful sexual harassment case in the United States -- Jenson vs. Eveleth Mines, where a woman who endured a range of abuse while working as a miner filed and won the landmark 1984 lawsuit.",/upxUN4zmX79o49mBW9htKZDeNq7.jpg,jXkVQm0QPyY
Megan Is Missing,6.289,573,2011-05-01,0,"Fourteen-year–old Megan and her best friend Amy spend a lot of time on the internet, posting videos of themselves and chatting with guys online. One night Megan chats with a guy named Josh who convinces her to meet him for a date. The next day, Megan is missing—forever. Based on actual cases of child abduction.",/a7ndLikcqvX7dF7gsYx5iDe7qq1.jpg,qolORalWZUw
Charlie Bartlett,6.673,570,2007-05-01,5254986,"Awkward teenager Charlie Bartlett has trouble fitting in at a new high school. Charlie needs some friends fast, and decides that the best way to find them is to appoint himself the resident psychiatrist. He becomes one of the most popular guys in school by doling out advice and, occasionally, medication, to the student body.",/l0jr9jSIW2TYFuunPtDQ1exyjtI.jpg,K86p21Th4qs
Firestarter,5.679,570,2022-05-12,15039250,"For more than a decade, parents Andy and Vicky have been on the run, desperate to hide their daughter Charlie from a shadowy federal agency that wants to harness her unprecedented gift for creating fire into a weapon of mass destruction. Andy has taught Charlie how to defuse her power, which is triggered by anger or pain. But as Charlie turns 11, the fire becomes harder and harder to control. After an incident reveals the family's location, a mysterious operative is deployed to hunt down the family and seize Charlie once and for all. Charlie has other plans.",/2MTGip0nfahQ1jPQCZSfCsPBZes.jpg,zs4mg5EmoHk
Che: Part Two,6.675,570,2008-12-12,8638163,"After the Cuban Revolution, Che is at the height of his fame and power. Then he disappears, re-emerging incognito in Bolivia, where he organizes a small group of Cuban comrades and Bolivian recruits to start the great Latin American Revolution. Through this story, we come to understand how Che remains a symbol of idealism and heroism that lives in the hearts of people around the world.",/t9nH3bZf0Ezs2jwk0bTkvRr89Ao.jpg,O7JIkJDxbzU
Barefoot,6.569,568,2014-02-02,15071,"The ""black sheep"" son of a wealthy family meets a young psychiatric patient who's been raised in isolation her entire life. He takes the naive young woman home for his brother's wedding an improbable romance blooms, as she impresses everyone with her genuine, simple charms.",/7CWdmxafzSVEUv4mMlOpw89NKXE.jpg,N2S-yOcHTOY
Million Dollar Arm,6.742,566,2014-05-09,38307627,"In a last-ditch effort to save his career, sports agent JB Bernstein dreams up a wild game plan to find Major League Baseball’s next great pitcher from a pool of cricket players in India. He soon discovers two young men who can throw a fastball but know nothing about the game of baseball. Or America. It’s an incredible and touching journey that will change them all — especially JB, who learns valuable lessons about teamwork, commitment and family.",/dQlyPJwRuUOJ6Ni0XWfEMrlPTu.jpg,lEtNIoPxcq8
Wolf Creek 2,6.399,565,2013-08-30,9630444,"Lured by the promise of an Australian holiday, backpackers Rutger, Katarina and Paul visit the notorious Wolf Creek Crater.  Their dream Outback adventure soon becomes a horrific reality when they encounter the site's most infamous local, the last man any traveller to the region ever wants to meet—Mick Taylor.  As the backpackers flee, Mick pursues them on an epic white knuckled rampage across hostile wasteland.",/uELzdTzPOpZwSFqBbwpjuKE7UW3.jpg,s4bqeT5edbs
Dead Snow 2: Red vs. Dead,6.567,565,2014-02-12,37473,"The gruesome Nazi Zombies are back to finish their mission, but our hero is not willing to die. He is gathering his own army to give them a final fight.",/bllzic3ydohA9i1fL3bCiRZMVK9.jpg,S0aj0xQqNEU
Two for the Money,6.051,564,2005-10-07,30526509,A former college athlete joins forces with a sports consultant to handicap football games for high-rolling gamblers.,/5SedPYdGLrp6LX9C2cWXLx38w1D.jpg,vcsdAwqZ-WI
Jackass 3.5,6.317,564,2011-04-01,0,"Johnny Knoxville of 'Jackass' releases unused material of stunts, tricks, antics and shenanigans shot during the production of 'Jackass 3D' that didn't make it into the film, as well as the hilarious outtakes.",/1dXigjDk1XTmwVBtKEB422LxgS.jpg,bR26swEzZ84
Luxo Jr.,7.071,563,1986-08-17,0,"A baby lamp finds a ball to play with and it's all fun and games until the ball bursts. Just when the elder Luxo thinks his kid will settle down for a bit, Luxo Jr. finds a ball ten times bigger.",/5IM6KmDyYX1rDPlZ4bQE617T8rZ.jpg,lkKf9DWmR04
Gotti,5.311,562,2018-06-14,4343227,"John Gotti rises to the top of the New York underworld to become the boss of the Gambino crime family. His life takes a tumultuous turn as he faces tragedy, multiple trials and a prison sentence.",/q869M8MTy0eynwfiE5vIlFgAUze.jpg,KyngLoe7U3k
Red Tails,6.476,562,2012-01-19,50365377,"The story of the Tuskegee Airmen, the first African-American pilots to fly in a combat squadron during World War II.",/jiORLnBsGcVcqIibkGBE213zAyh.jpg,NVq6Xr5fcfk
Look Both Ways,6.907,560,2022-08-16,0,"On the eve of her college graduation, Natalie's life diverges into two parallel realities: one in which she becomes pregnant and must navigate motherhood as a young adult in her Texas hometown, the other in which she moves to LA to pursue her career. In both journeys throughout her twenties, Natalie experiences life-changing love, devastating heartbreak and rediscovers herself.",/jq8IGJgg16mJ95a5OPyS7eGJaam.jpg,wnC0ZG-R7yo
Kill the Irishman,6.73,559,2011-03-10,1188194,"Over the summer of 1976, thirty-six bombs detonate in the heart of Cleveland while a turf war raged between Irish mobster Danny Greene and the Italian mafia. Based on a true story, Kill the Irishman chronicles Greene's heroic rise from a tough Cleveland neighborhood to become an enforcer in the local mob.",/2alYRtXyNKdCvIhMRofdC0lvLZi.jpg,x2zN53Vwnz0
Backcountry,5.849,558,2015-03-20,0,A couple on a deep-wilderness hike become hopelessly lost within an aggressive black bear's territory.,/AdIkDCWcBqv1B10ncm71sMiqEEF.jpg,ey9fi6m95vo
No One Lives,5.868,555,2013-03-09,74918,A gang of ruthless highway killers kidnap a wealthy couple traveling cross country only to shockingly discover that things are not what they seem.,/dmO5x4STbulw9BlZaVRQF3tHg3t.jpg,7Eiko_J6mfE
The Missing,6.302,553,2003-11-26,38364277,"When rancher and single mother of two Maggie Gilkeson sees her teenage daughter, Lily, kidnapped by Apache rebels, she reluctantly accepts the help of her estranged father, Samuel, in tracking down the kidnappers. Along the way, the two must learn to reconcile the past and work together if they are going to have any hope of getting Lily back before she is taken over the border and forced to become a prostitute.",/86s5nw5F1G8lJtEowO0LBB4hoBW.jpg,trjxmsqyryg
Hobo with a Shotgun,5.921,553,2011-05-06,748453,"A vigilante homeless man pulls into a new city and finds himself trapped in urban chaos, a city where crime rules and where the city's crime boss reigns. Seeing an urban landscape filled with armed robbers, corrupt cops, abused prostitutes and even a pedophile Santa, the Hobo goes about bringing justice to the city the best way he knows how - with a 20-gauge shotgun. Mayhem ensues when he tries to make things better for the future generation. Street justice will indeed prevail.",/xxMaO7VoN2BnZit79PedVHnTjcO.jpg,ssHEAOrAdCU
Nights in Rodanthe,6.252,550,2008-09-26,84375061,"Adrienne is trying to decide whether to stay in her unhappy marriage or not, and her life changes when Paul, a doctor who is travelling to reconcile with his estranged son, checks into an inn where she is staying.",/nyB5BeSNJUcWwKN7ypCMjbvnarq.jpg,v_juDaAGn9c
W.,6.269,549,2008-10-17,29506464,"The story of the eventful life of George W. Bush—his struggles and triumphs, how he found both his wife and his faith—and the critical days leading up to his decision to invade Iraq.",/nJm8UF4zbUYEoku9seEtz1PTJGS.jpg,ZdJd5y3mHEU
White Noise,5.58,549,2022-11-25,71476,"Jack Gladney, professor of Hitler studies at The-College-on-the-Hill, husband to Babette, and father to four children/stepchildren, is torn asunder by a chemical spill from a rail car that releases an ""Airborne Toxic Event"" forcing Jack to confront his biggest fear - his own mortality.",/1a48bfLQm57ByADdw05uRMoFCZc.jpg,haHHr5_VX7I
Furry Vengeance,4.918,549,2010-04-30,36236710,"When real estate developer Dan Sanders finalizes plans to level a swath of pristine Oregon forest to make way for a soulless housing subdivision, a band of woodland creatures rises up to throw a monkey wrench into the greedy scheme. Just how much mischief from the furry critters can the businessman take before he calls it quits?",/vR8BBTRxU2xu0FvrTTio8CvCwi3.jpg,o7fTpBOI1xo
"Food, Inc.",7.298,548,2008-09-07,0,"Documentary filmmaker Robert Kenner examines how mammoth corporations have taken over all aspects of the food chain in the United States, from the farms where our food is grown to the chain restaurants and supermarkets where it's sold. Narrated by author and activist Eric Schlosser, the film features interviews with average Americans about their dietary habits, commentary from food experts like Michael Pollan and unsettling footage shot inside large-scale animal processing plants.",/3IMNzRog9pNdR1k743vocL3cc2H.jpg,IJDGUxqEdYY
Conviction,7.065,546,2010-10-15,11826980,"When Betty Anne Waters' older brother Kenny is arrested for murder and sentenced to life in 1983, Betty Anne, a Massachusetts wife and mother of two, dedicates her life to overturning the murder conviction. Convinced that her brother is innocent, Betty Anne puts herself through high school, college and, finally, law school in an 18 year quest to free Kenny. With the help of best friend Abra Rice, Betty Anne pores through suspicious evidence mounted by small town cop Nancy Taylor, meticulously retracing the steps that led to Kenny's arrest. Belief in her brother - and her quest for the truth - pushes Betty Anne and her team to uncover the facts and utilize DNA evidence with the hope of exonerating Kenny.",/aA4OEmy5QDnPNv2o2w5nCy52QBK.jpg,NrPtr0aQx3s
Black Dynamite,7.127,541,2009-10-16,296557,"This is the story of 1970s African-American action legend Black Dynamite. The Man killed his brother, pumped heroin into local orphanages, and flooded the ghetto with adulterated malt liquor. Black Dynamite was the one hero willing to fight The Man all the way from the blood-soaked city streets to the hallowed halls of the Honky House.",/u3oWQDz0JggzzsVlsuHY7XVxp5Y.jpg,96Y24a0cyCE
World's Greatest Dad,6.576,541,2009-08-20,295750,"In the wake of a freak accident, Lance suffers the worst tragedy and the greatest opportunity of his life. He is suddenly faced with the possibility of fame, fortune and popularity, if he can only live with the knowledge of how he got there.",/1ESsZLvZPIvbCPCh7CPCSnF4EeH.jpg,VBzZvAzAMvY
Rabbit Hole,6.68,540,2010-12-16,5144717,Life for a happy couple is turned upside down after their young son dies in an accident.,/zTUQXwMn4ndt5AAcDvJCi14ZY2B.jpg,K9iJH2P96dM
Nine,5.52,539,2009-12-03,53825515,"Arrogant, self-centered movie director Guido Contini finds himself struggling to find meaning, purpose, and a script for his latest film endeavor. With only a week left before shooting begins, he desperately searches for answers and inspiration from his wife, his mistress, his muse, and his mother.",/bSxdTXktgPQPNwlkQ0DZtuAJXlb.jpg,cSAmAP_yWpY
Religulous,7.063,538,2008-10-01,0,"Commentator-comic Bill Maher plays devil's advocate with religion as he talks to believers about their faith. Traveling around the world, Maher examines the tenets of Christianity, Judaism and Islam and raises questions about homosexuality, proof of Christ's existence, Jewish Sabbath laws, violent Muslim extremists.",/hBv5LCbWxPB8iU77dwurSGMVZ3N.jpg,XdkyLrDpaUg
Frequently Asked Questions About Time Travel,6.882,536,2009-04-24,23820,Follows three social outcasts -- two geeks and a cynic -- as they attempt to navigate a time-travel conundrum in the middle of a British pub. Faris plays a girl from the future who sets the adventure in motion.,/r67KzlHkdiwe3fBWzImEkNOg1Y.jpg,WBV340x3GcA
Supergirl,5.399,535,1984-07-01,14296438,"After losing a powerful orb, Kara, Superman's cousin, comes to Earth to retrieve it and instead finds herself up against a wicked witch.",/udiuthupEo8wqMXddkQZNWY1ZLY.jpg,gN-mEvkRUOI
Extract,5.806,532,2009-09-03,10848783,"The owner of a factory that produces flavor extracts, Joel Reynold seems to have it all, but really doesn't. What's missing is sexual attention from his wife, Suzie. Joel hatches a convoluted plan to get Suzie to cheat on him, thereby clearing the way for Joel to have an affair with Cindy, an employee. But what Joel doesn't know is that Cindy is a sociopathic con artist, and a freak workplace accident clears the way for her to ruin Joel forever.",/cjen0vxjybwItQPH3NNCJuME2MY.jpg,KQrjlWZmM8E
Secretariat,7.4,532,2010-08-20,60321861,"Housewife and mother Penny Chenery agrees to take over her ailing father's Virginia-based Meadow Stables, despite her lack of horse-racing knowledge. Against all odds, Chenery - with the help of veteran trainer Lucien Laurin - manages to navigate the male-dominated business, ultimately fostering the first Triple Crown winner in 25 years.",/9bpAR3ALEfaqosxbi9zpuv9FH7F.jpg,UKmuvjL2cVw
Catch and Release,5.897,530,2006-10-20,16162580,"For a grieving fiancée, learning to love again requires the help of her late love's three best friends.",/4NanpeAso4c2KFdjHiJ3stByHHS.jpg,6NuyXTNQsJY
Prayers for Bobby,8.072,529,2009-01-24,0,"Bobby Griffith was his mother's favorite son, the perfect all-American boy growing up under deeply religious influences in Walnut Creek, California. Bobby was also gay. Struggling with a conflict no one knew of, much less understood, Bobby finally came out to his family.",/1viFwXluAettogGDsTrSUUg29lZ.jpg,sSee8On2lEQ
Imagine That,5.914,529,2009-06-19,23000000,"A financial executive who can't stop his career downspiral is invited into his daughter's imaginary world, where solutions to his problems await.",/lyCTP5C3raH46hJNS9WfBSnWHsG.jpg,70U393tWjrw
Vanishing on 7th Street,5.347,526,2010-09-11,1671196,"A mysterious global blackout yields countless populations to simply vanish, leaving only their clothes and possessions behind. A small handful of survivors band together in a dimly-lit tavern on 7th Street, struggling to combat the apocalyptic horror. Realizing they may in fact be the last people on earth, a dark shadow hones in on them alone.",/8LkZFmL2UHbmP7UnjlRP5gqvvqh.jpg,X-RA1U2rAw8
My Cousin Rachel,5.678,526,2017-06-08,9200168,"A young Englishman plots revenge against his mysterious, beautiful cousin, believing that she murdered his guardian. But his feelings become complicated as he finds himself falling under the beguiling spell of her charms.",/yz9Pnx5tbpZOHWsCD0LtoTCgmLi.jpg,8fKjZDgat_0
Tom and Jerry: The Movie,6.266,522,1992-10-01,0,The popular cartoon cat and mouse are thrown into a feature film. The story has the twosome trying to help an orphan girl who is being berated and exploited by a greedy guardian.,/k68ZB5trRKcEJSQdPiY6jtxVq14.jpg,v6dY_fIbA-8
Best in Show,6.913,520,2000-09-29,0,"The tension is palpable, the excitement is mounting and the heady scent of competition is in the air as hundreds of eager contestants from across America prepare to take part in what is undoubtedly one of the greatest events of their lives -- the Mayflower Dog Show. The canine contestants and their owners are as wondrously diverse as the great country that has bred them.",/kVNaXzoX64YwLC99o4gXyKPnplS.jpg,K-BggWWn_bw
Rent,6.82,520,2005-11-17,31670620,"This rock opera tells the story of one year in the life of a group of bohemians struggling in late 1980s East Village, New York, USA. The film centers around Mark and Roger, two roommates. While a  tragedy has made Roger numb to new experiences, Mark begins capturing their world through his attempts to make a personal movie. In the year that follows, they and their friends deal with love, loss, and working together.",/fomBrfOHWxlaVcjPk4yCQgIwAnh.jpg,0Y_5elAHSX4
Severance,6.3,517,2006-05-19,5515163,"Members of the Palisades Defense Corp. sales group arrive in Europe for a team-building exercise. A fallen tree blocks the route, and they must hike to their destination. However, a psychotic killer lurks in the woods, and he has a horrible fate in mind for each of the co-workers.",/yg1XRTyH5knwh3Tnij2sUV0ZZ5w.jpg,OQ4e1558QY0
Afflicted,6.463,513,2014-04-04,121179,Two friends' tour of Europe takes a dark turn when one of them contracts a mysterious illness. They race to find out what it is and how to cure it before the sickness consumes him completely.,/bMkRWgAvwe0XkpL8swG7UA4N4Q8.jpg,WkvCNae3Ip8
Siberia,4.715,510,2018-07-13,2006704,"Lucas, a diamond trader who travels to Saint Petersburg to arrange a sale, discovers that his Russian business partner has left his hotel and gone to a small Siberian village, so Lucas also heads there to try find him.",/eGfIsvdrUhTlQOkxQIELU7obDYj.jpg,PPIFkZ41PYo
Memoirs of an Invisible Man,5.909,508,1992-02-28,14358033,"After a freak accident, an invisible yuppie runs for his life from a treacherous CIA official while trying to cope with his new life.",/bdhxHQNwYdjkyFx9DwebXtama0U.jpg,eEeHNzGFMZo
The End of the Tour,7.093,507,2015-07-31,3002884,"The story of the five-day interview between Rolling Stone reporter David Lipsky and acclaimed novelist David Foster Wallace, which took place right after the 1996 publication of Wallace's groundbreaking epic novel, 'Infinite Jest.'",/1pt7dX0oaFxgPT02OiHZK3O0gbg.jpg,DBk1Mrb4RyM
Cloud 9,6.892,506,2014-01-17,0,"Set high atop snow-capped mountains in the adrenaline-fueled world of competitive snowboarding, the Disney Channel Original Movie “Cloud 9″ tells the inspiring story of two snowboarders who must overcome self-doubt to learn that achieving their dreams is possible.",/ztrYqCPwFult7UMTiHyVxp1xHSc.jpg,EEesS6p8kdo
Cypher,6.654,505,2002-10-01,898365,"An unsuspecting, disenchanted man finds himself working as a spy in the dangerous, high-stakes world of corporate espionage. Quickly getting way over-his-head, he teams up with a mysterious femme fatale.",/cqSvgtox4Ceq79HamAecBq2yS66.jpg,4td2af6Eqig
Tideland,6.49,501,2005-09-09,566611,"Because of the actions of her irresponsible parents, a young girl is left alone on a decrepit country estate and survives inside her fantastic imagination.",/juYEAmlSniLwjBjTV2JQ489pAo5.jpg,RXw2q4qzud4
MacGruber,5.483,501,2010-05-21,9322895,"Ex-special operative MacGruber is called back into action to take down his archenemy, Dieter Von Cunth, who's in possession of a nuclear warhead and bent on destroying Washington, DC.",/9cO8JD7aaQzI4q8lBS8MYXH8LrJ.jpg,PKYrghKwu2E
Somewhere in Time,7.524,500,1980-10-02,0,"Young writer Richard Collier is met on the opening night of his first play by an old lady who begs him to ""Come back to me"". Mystified, he tries to find out about her, and learns that she is a famous stage actress from the early 1900s. Becoming more and more obsessed with her, by self-hypnosis he manages to travel back in time—where he meets her.",/hmdegiSwVYUNvEfihaE3HRM3Sos.jpg,9uicvPZSKIM
BloodRayne,4.116,497,2005-10-22,3650275,"In 18th-century Romania, after spending much of her life in a traveling circus, human-vampire hybrid Rayne escapes and plots to take down her father, Kagan, the evil vampire king. When she's discovered by three vampire hunters, she manages to convince them to spare her life and join her cause. But slaying a vampire as powerful as Kagan will be no easy task.",/1Xy9uu5INNMnyF7W6BTEQkkGOZC.jpg,F_dmvG9QM8U
Dark Star,5.965,497,1974-04-01,0,"A group of scientists are sent on a mission to destroy unstable planets. 20 years into their mission, they have to battle their alien mascot as well as a ""sensitive"" and intelligent bombing device that starts to question the meaning of its existence.",/nybQ7cBbSlgCikFhpULiKCfJcuQ.jpg,CbjhPVENHEA
Southland Tales,5.113,494,2007-11-14,374743,"Set in the futuristic landscape of Los Angeles on July 4, 2008, as it stands on the brink of social, economic and environmental disaster. Boxer Santaros is an action star who's stricken with amnesia. His life intertwines with Krysta Now, an adult film star developing her own reality television project, and Ronald Taverner, a Hermosa Beach police officer who holds the key to a vast conspiracy.",/7dbIDQ80z4bxiDlAvxRwc5TI44C.jpg,vtp14ikRvxo
Wristcutters: A Love Story,6.943,492,2007-10-19,0,"Zia, distraught over breaking up with his girlfriend, decides to end it all. Unfortunately, he discovers that there is no real ending, only a run-down afterlife that is strikingly similar to his old one, just a bit worse. Discovering that his ex-girlfriend has also ""offed"" herself, he sets out on a road trip to find her.",/qModiIR60IMLP28ruGZluQOtsOj.jpg,H1xRtrKq1kc
Friday Night Lights,6.917,487,2004-10-08,61255921,"A small, turbulent town in Texas obsesses over their high school football team to an unhealthy degree. When the star tailback, Boobie Miles, is seriously injured during the first game of the season, all hope is lost, and the town's dormant social problems begin to flare up. It is left to the inspiring abilities of new coach Gary Gaines to instill in the other team members -- and, by proxy, the town itself -- a sense of self-respect and honor.",/8HIqpOgqShRc3TAleabnYispDl1.jpg,oHJVJ_MEyQI
Mistress America,6.581,487,2015-08-14,2500431,"Tracy, a lonely college freshman in New York, is rescued from her solitude by her soon-to-be stepsister Brooke, an adventurous gal about town who entangles her in alluringly mad schemes.",/rvwV64gSgftNFIOkWBZhan17R27.jpg,xq5JgOGEvbY
