title,vote_average,vote_count,release_date,revenue,overview,poster_path,youtubeId
Incendiary,5.317,153,2008-01-20,0,A woman's life is torn apart when her husband and infant son are killed in a suicide bombing at a soccer match.,/jJWBiaN0nCRdbKpFKEkUIZe3Q6b.jpg,GRjkXY4TFKA
Cropsey,6.007,152,2009-04-25,35456,"Realizing the urban legend of their youth has actually come true, two filmmakers delve into the mystery surrounding five missing children and the real-life boogeyman linked to their disappearances.",/mcmJj11lX8v518rvzYb22LlCjAz.jpg,lDM-Ef2cZqY
Cocaine Cowboys,7.286,152,2006-11-03,163000,"In the 1980s, ruthless Colombian cocaine barons invaded Miami with a brand of violence unseen in this country since Prohibition-era Chicago - and it put the city on the map. ""Cocaine Cowboys"" is the true story of how Miami became the drug, murder and cash capital of the United States, told by the people who made it all happen.",/gxGis0HgcLJv2MS3l01a0wuhCAI.jpg,4Kbitg2mKOM
Tupac: Resurrection,7.838,151,2003-11-14,7808524,"Home movies, photographs, and recited poetry illustrate the life of Tupac Shakur, one of the most beloved, revolutionary, and volatile hip-hop MCs of all time.",/dGJxjq8npqFZtuAtGsyjntip7uh.jpg,DbIAVT_XZBU
Resurrection,6.11,150,2022-07-29,0,"A woman's carefully constructed life is upended when an unwelcome shadow from her past returns, forcing her to confront the monster she's evaded for two decades.",/kfRr8Jm1gaEnLTXCIfHkSw8QW6t.jpg,RlyAnuafYV8
Pokémon the Movie: Black - Victini and Reshiram,6.59,150,2011-07-16,0,"The Kingdom of the People of the Earth once ruled over the land, but now all that remains is the Sword of the Earth. in the city of Eindoak. Satoshi, Iris, and Dent arrive in Eindoak during a harvest festival's Pokémon Tournament and meet the legendary Pokémon Victini who wishes to share its powers of victory to someone. Elsewhere in the city, a descendant of the People of the Earth named Dred Grangil has arrived who seeks to revive the kingdom's power with the Sword of the Earth, bringing them back into power over the land, and Satoshi and his friends must stop him before he destroys the land along with Victini.",/qPfo5ooRJWUczk3KXv8CnUmNkTl.jpg,xvHSNkdfm3Y
Monday,6.683,150,2020-09-11,0,"A spark on a Friday can lead to a sizzling weekend fling, but what happens when you get to the inevitable Monday?",/o4Gc5quiCBtiW6mgkPvDWKAiFVs.jpg,E5zA-j5WZUQ
Red Hill,5.98,149,2010-11-05,324424,"Young police officer Shane Cooper's first day on duty, after relocating to the small town of Red Hill, rapidly turns into a nightmare. News of a prison break, involving convicted murderer Jimmy Conway, sends the local law enforcement officers - led by the town's ruling presence, Old Bill - into a panic and leads to a terrifying and bloody confrontation.",/fLELMBUdDoqJvPDE7CcYn0Ny6y8.jpg,M9MouXxXREA
Chasing Ice,7.426,148,2012-10-01,1328467,"When National Geographic photographer James Balog asked, “How can one take a picture of climate change?” his attention was immediately drawn to ice. Soon he was asked to do a cover story on glaciers that became the most popular and well-read piece in the magazine during the last five years. But for Balog, that story marked the beginning of a much larger and longer-term project that would reach epic proportions.",/q4T6Wqh7ZXzf30odR2Yo2dLWdZ.jpg,eIZTMVNBjc4
Young Adam,5.855,148,2003-09-26,2500000,A young drifter working on a river barge disrupts his employers' lives while hiding the fact that he knows more about a dead woman found in the river than he admits.,/rU5GJ5r4tQbSx9C2ENKbPkD6nr9.jpg,V4LexLpsGxQ
Shine a Light,6.845,148,2008-04-04,0,"Martin Scorsese and the Rolling Stones unite in ""Shine A Light,"" a look at The Rolling Stones."" Scorsese filmed the Stones over a two-day period at the intimate Beacon Theater in New York City in fall 2006. Cinematographers capture the raw energy of the legendary band.",/rMVrNWWaO3xAWZHFUbeamWPzVAC.jpg,V2dGuxTsuxY
Gentlemen Broncos,5.7,147,2009-09-30,0,A teenager attends a fantasy writers' convention where he discovers his idea has been stolen by an established novelist.,/ifiqtvAtRN3Onuq0OACAQ4PwHEj.jpg,qdpFpfIBkXc
Raze,5.13,146,2013-04-21,0,"After Sabrina is abducted, she finds herself in an underground lair, forced to do battle with other innocent women for the amusement of unseen spectators. Each of these reluctant warriors has something to lose, but only one will remain when the game is done.",/q0VnSnewZjsoMfDQu9j3vZ4vQzr.jpg,6vAs4ZkGGSE
Giallo,4.11,146,2010-03-13,50113,"In Italy, a woman fears her sister has been kidnapped; Inspector Enzo Avolfi fears it's worse. They team up to rescue her from a sadistic killer known only as Yellow.",/4T1DfeTROHXDaygI3PdyZqDbMtj.jpg,HMRCfdFr1FE
Taking Chance,7.09,145,2009-09-21,0,"Lt. Col. Michael Strobl, a volunteer military escort accompanies the body of Lance Cpl. Chance Phelps to his hometown in Wyoming.",/q0RjelNIn0zEi9nhSqQgDTbmXux.jpg,MtmiLdzzgGE
Tabu,7.024,145,2012-04-05,0,"Lisbon, Portugal, 2010. Pilar, a pious woman devoted to social causes, maintains a peculiar relationship with her neighbor Aurora, a temperamental old woman obsessed with gambling who lives tormented by a mysterious past.",/mtr1ztUkJs6jsYdzK3gBLsuffr4.jpg,nQw5H_u-N6g
Poultrygeist: Night of the Chicken Dead,5.944,144,2006-12-26,0,"When the American Chicken Bunker, a military themed fast food restaurant, builds its latest chain restaurant on the site of an ancient Native American burial ground, the displaced spirits take revenge on unsuspecting diners and transform them into chicken zombies! Now, it’s up to a dimwitted counter boy, his collegiate lesbian ex-girlfriend and a burqa-wearing fry cook to put an end to the foul feathered menace once and for all.",/vSeehH4s274kdZXEMKnPE2tlqco.jpg,7KQCX0zNdyc
Heartless,5.851,144,2009-11-21,0,"The story follows Jamie, a troubled young man with a birthmark on his face, which has left him feeling isolated and fearful, hiding from the world outside. He lives in the East End of London, an area notorious for its violent hooded gangs. According to news reports, the gangs are now wearing demon masks. But, one night, Jamie discovers the terrifying truth.",/3kRaWKYqtx9nyqcIkdTf58igzVb.jpg,oCmvhghjmsk
While She Was Out,5.308,143,2008-10-27,498088,A suburban housewife is forced to fend for herself when she becomes stranded in a desolate forest with four murderous thugs.,/ehhJzxVV566RxPKmotY4E6xU477.jpg,xboYrgpn-S4
Outsourced,6.38,142,2007-09-28,0,"After his entire department is outsourced, an American novelty products salesman heads to India to train his replacement.",/i6q5j4jnfHKq9GhR4LJZKGGwrID.jpg,LImhTTFu4b8
In the Land of Blood and Honey,5.813,142,2011-12-22,303877,"During the Bosnian War, Danijel, a soldier fighting for the Serbs, re-encounters Ajla, a Bosnian who's now a captive in his camp he oversees. Their once promising connection has become ambiguous as their motives have changed.",/h1r4qey0K8PG9OgQdDqQcXtMq6c.jpg,wDBU8CqU0dg
Ready to Rumble,5.257,142,2000-04-07,12372410,Two slacker wrestling fans are devastated by the ousting of their favorite character by an unscrupulous promoter.,/rGbMrCUh6eRiWKsHNf5kqgPoliZ.jpg,AfTvmbizNyQ
Little Men,6.567,141,2016-08-05,0,"Jake is a quiet, sensitive middle schooler with dreams of being an artist. He meets the affably brash Tony at his grandfather's funeral, and the unlikely pair soon hit it off. The budding friendship is put at risk, however, when a rent dispute between Jake's father, Brian, and Tony's mother, Leonor, threatens to become contentious.",/mMmXSUZ66XoxmT4zdkUkVDdU8Mu.jpg,8C56EYhzyTs
Hello Ladies: The Movie,6.479,141,2014-11-22,0,"When Stuart learns that his British ex-girlfriend is planning to visit Los Angeles with her husband, he sets out to impress them with his glamorous lifestyle, enlisting a Russian model he’s just met to play the role of his beautiful girlfriend. What could go wrong?",/7O41oM6Va5wffkIjunwqAoseNs9.jpg,LyMeLxe7NPE
Blue in the Face,6.603,141,1995-09-15,1275000,"Auggie runs a small tobacco shop in Brooklyn, New York. The whole neighborhood comes to visit him to buy cigarettes and have some small talk. During the movie Lou Reed tries to explain why he has to have a cut on his health insurance bill if he keeps smoking and Madonna acts as a Singing Telegram.",/yBFNJA95MNiasdNUPCU6otdtJE8.jpg,72ue1Jqy01E
Interview,6.376,141,2007-07-13,0,"After falling out with his editor, a fading political journalist is forced to interview America's most popular soap actress.",/jObPGoyEcBFB8x5j3Htabavgcxx.jpg,vCHUibmnZi4
Gigantic,5.664,140,2008-09-09,165888,"Young mattress salesman Brian decides to adopt a baby from China but is distracted when he forms a relationship with quirky, wealthy Harriet whom he meets at his mattress store. As their relationship flourishes, unbeknownst to them, a hitman is trying to kill Brian.",/oCWQdoytzRxPivnvdVbFgkdksc0.jpg,ePVG8iqYnt4
The Student,6.536,140,2016-04-12,0,A high school student becomes convinced that the world is lost to evil and begins to challenge the morals and beliefs of the adults surrounding him.,/8bRX3YSXNWzCTMRtlFkWcJJeg1r.jpg,hM4Ctg51IeY
For Greater Glory: The True Story of Cristiada,6.691,139,2012-06-01,9622846,"A chronicle of the Cristeros War (1926-1929), which was touched off by a rebellion against the Mexican government's attempt to secularize the country.",/7jgh0ej04j98q2NFpSZLlpDazUo.jpg,3KiagxENUv4
Last Passenger,5.6,138,2013-10-18,0,"Independent British thriller starring Dougray Scott and Kara Tointon. Lewis (Scott), an overworked doctor, is on his way home from London with his young son Max (Joshua Kaynama). Clearly exhausted from his work, Lewis decides to take a nap on the train while an attractive young woman (Tointon) watches over his son. When he wakes, all but a few passengers have alighted and he realises that the train is not stopping to let anyone else off. Determined to get to the bottom of the mystery, Lewis goes to investigate and finds that the train has been taken over by an unstable driver who is hellbent on destroying the vehicle along with all the remaining passengers on board.",/ntIHy3C3Xgd5bl0c85pFX6joTFq.jpg,grI0gJyxhw8
Essential Killing,5.762,138,2010-09-06,0,A Taliban soldier struggles to survive after he escapes his captors and flees into the Polish countryside.,/gwLUPEqjHz55khkXeQB3hOYx1ao.jpg,_0CR2N4xbfQ
Tiny Furniture,5.7,138,2010-11-12,416498,"After graduating from film school, Aura returns to New York to live with her photographer mother, Siri, and her sister, Nadine, who has just finished high school. Aura is directionless and wonders where to go next in her career and her life. She takes a job in a restaurant and tries unsuccessfully to develop relationships with men, including Keith, a chef where she works, and cult Internet star Jed.",/5T81WvUlc1Our3UwmluXBBc3L0k.jpg,PF_jWPJwKIE
Married Life,5.7,137,2007-09-12,2888315,"A very gentle middle-aged man is married, but when he falls in love with another woman, he decides that to divorce his wife would humiliate her too much – so instead he decides to kill her.",/AdJKmRh3AKX5CVCdwdw1dNTqEJ8.jpg,qZuwODsFRC8
Brideshead Revisited,6.343,137,2008-07-25,13204291,"Based on Evelyn Waugh's 1945 classic British novel, Brideshead Revisited is a poignant story of forbidden love and the loss of innocence set in England prior to the Second World War.",/bfL9uCXHpQ8dryueFCh2BA8R75u.jpg,cwUA82BGUdk
One from the Heart,5.7,136,1982-02-11,636796,"Hank and Frannie don't seem to be able to live together anymore. After a five-year relationship, lustful and dreamy Frannie leaves down-to-earth Hank on the anniversary of their relationship. Each one of them meets their dream mate, but as bright as they may seem, they are but a stage of lights and colors. Will true love prevail over a seemingly glamorous passion?",/3IIaxbBfRdEqgQAj7bxM6waoSuw.jpg,g6aYLIn9zXs
Mr. Nice,6.051,136,2010-10-07,850994,"Biopic about 1970s Welsh marijuana trafficker Howard Marks, whose inventive smuggling schemes made him a huge success in the drug trade, as well as leading to dealings with both the IRA and British Intelligence. Based on Marks' biography with the same title.",/uag1ajVUMuHTXqkX0H52z0FveON.jpg,vk_jsXRb17U
Mega Piranha,3.2,136,2010-04-10,0,"When a science experiment goes horribly wrong, gigantic fish gain appetites for human flesh.",/vZB82Iqg28c5UxY3maGg1gGr3yF.jpg,pFhSogGnu4I
From Within,5.548,135,2008-04-25,66456,"When the citizens of a small evangelical town systematically begin committing suicide, a young girl struggling to reconcile her Christian upbringing with her desire to experience the outside world finds her faith put to the ultimate test.",/yyAiGq6SycABwV9m9KqqB2i6Ctl.jpg,tTNtrVJ7Rs8
Masquerade,7.7,135,2012-09-13,0,"Though it places his own life in danger, a look-alike commoner secretly takes the place of a poisoned king to save his country from falling into chaos.",/htOuhpB44segRvgwkQWyPYvMp7b.jpg,l4RpoT-Lps8
Geography Club,6.222,135,2013-04-27,0,"A coming-of-age movie that tells a story unfolding in every high school around the country -- a story of kids hiding their true identities in plain sight, even as they feverishly pursue their hearts' desires.",/oPwDoem41nOxe1tEI5p65tYTbpe.jpg,Kyv91MU52CM
Forks Over Knives,7.1,135,2011-05-06,664747,"Examines the profound claim that most, if not all, of the degenerative diseases that afflict us can be controlled, or even reversed, by rejecting our present menu of animal-based and processed foods.",/8nG4dXqfPuoBfgMlrsd8oPvvKPi.jpg,F-OzTWY2J8E
YellowBrickRoad,4.664,134,2010-01-23,0,"In the Fall of 1940, the entire population of Friar, New Hampshire walked together up a winding mountain trail and into the wilderness. Without warning, they left behind everything: their homes, their clothes, and their money. The only clue where they went was a single word etched into stone near the forest’s edge: YELLOWBRICKROAD.",/p4QniB5ek1DCD2EHZSDvcwyVkrZ.jpg,yzJgKbk50JQ
Another Country,6.474,134,1984-06-01,0,"In Moscow in 1983, an American journalist interviews Guy Bennett, who recalls his last year at public school, fifty years before, and how it contributed to him becoming a spy.",/9wLbEvG9rYfSPnAXLvCz8T0Una2.jpg,Lf8SvfsVCmg
L!fe Happens,5.44,134,2011-06-18,30905,"A comedy centered on two best friends, Kim and Deena, who fight to maintain normalcy in their lives after Kim gets pregnant and has a baby.",/xFq3IQEWCBBoPP7pCb4TarAi8tt.jpg,93zM_4SugMI
Amer,6.252,133,2009-09-23,0,"Ana is confronted with body and desire at three key moments of her life. As a young girl, she brings her dead grandpa back to life. In her puberty, she discovers the power of decay and sexuality. Finally, she wrestles with loss and loneliness when she returns to her parental home, now derelict.",/93XYVtdMvk05WLvjGs5qeyHtFVL.jpg,P2uQWKleAzM
Bellflower,5.936,133,2011-04-16,101236,"Two friends spend all their free time building flame-throwers and weapons of mass destruction in hopes that a global apocalypse will occur and clear the runway for their imaginary gang ""Mother Medusa"".",/4bGB2k4JngWLVABKIw1S7cnlh5h.jpg,j3KX2IPTbjE
Ishtar,4.443,132,1987-05-15,14375181,"Two terrible lounge singers get booked to play a gig in a Moroccan hotel but somehow become pawns in an international power play between the CIA, the Emir of Ishtar, and the rebels trying to overthrow his regime.",/dX7O1ixhaCSlAWadCYYvBKEdwYu.jpg,8KdQ7Gig770
Cat Run,5.326,132,2011-04-01,65708,"When a sexy, high-end escort holds the key evidence to a scandalous government cover-up, two bumbling young detectives become her unlikely protectors from a ruthless assassin hired to silence her.",/2QnqQn7W2IjVEgK6mmUIkfQWY19.jpg,1JbTsW3QqP8
Mystery Team,6.323,130,2009-08-28,0,A group of former Encyclopedia Brown-style child-detectives struggle to solve an adult mystery.,/npi5W12mH4HTXzCoYnRzRtrnIhP.jpg,nxx1vOhlqmM
Caravaggio,6.146,130,1986-08-29,0,"A retelling of the life of the celebrated 17th-century Baroque painter Michelangelo Merisi da Caravaggio through his brilliant, nearly blasphemous paintings and his flirtations with the underworld.",/4TsayIEhoId7iahurgpKSNdSdEo.jpg,Z5ZvKnLNZpg
Free to Play,6.919,130,2014-03-19,0,"Follow three professional video game players as they overcome personal adversity, family pressures, and the realities of life to compete in a $1,000,000 tournament that could change their lives forever.",/ohLJT2UiFLsiw3SeXrbw6dxT7Fg.jpg,R-RKqGaNq-Y
Lymelife,6.042,130,2008-09-08,0,"A coming of age dramedy where infidelity, real estate, and Lyme disease have two families falling apart on Long Island in the early eighties. Scott, 15, is at the point in his life when he finds out that the most important people around him, his father, his mother, and his brother, are not exactly who he thought they were. They are flawed and they are human.",/jLo39N9UuiRJlL3cRytkM7BzZK5.jpg,qRckkaOLaRw
Sniper 2,5.399,129,2002-12-28,0,"A former Marine sniper is lured back in on a top-secret mission to take out a rogue general accused of running a stealth operation of hit-and-run ethnic cleansing missions in an area known as ""No Man's Land.""",/dmHfc2h9bpCFOloUj54jntM0c9L.jpg,pbIXViyOl4M
Elektra Luxx,4.7,128,2011-03-11,10,"A favor for a woman from her past throws the life of a pregnant, retired porn star into chaos.",/eLv57AjGugpx2shfaq9crEBVioL.jpg,0mZ2frHg2pA
Novocaine,5.941,128,2001-11-23,2025238,A dentist finds himself a murder suspect after a sexy patient seduces him into prescribing her drugs.,/6ZVFepWKzYho4DLhyFVuRk7klZ1.jpg,xEKZyITGsJQ
Greed,5.6,127,2019-09-07,0,A retail billionaire's 60th birthday party is celebrated in an exclusive hotel on the Greek island of Mykonos.,/mZPmDFlVp1BSGQD4QCKHOwbXLfv.jpg,MGjSpPgJAoA
Flesh & Blood,6.886,127,2018-11-02,0,"Kimberly, a teenager suffering from agoraphobia, has not left the house since her mother's unsolved murder. On the eve of Thanksgiving, she begins to suspect that the safe harbor of home and her doting father may be a dangerous mirage.",/vvgWkpGsuCSzNZuqenQZUl9EtXe.jpg,3djxsIb9KHc
Nude Nuns with Big Guns,4.4,126,2010-09-24,0,"Upon taking her vows to become a nun, Sister Sarah is abused, brainwashed and also drugged into submission by the corrupt clergy. On the verge of her own death from a lethal dose of drugs, Sister Sarah receives a message from God telling her to take vengeance on all those who did wrong to her. Armed with God's will and an arsenal of big guns, she dispenses Judgment Day on her former tormentors. When the church hires the merciless motorcycle gang ""Los Muertos"" to track down and to kill her they soon realize that this sister is one bad mother.",/5EEtzqJeNZKbh0PTEBQmc8QotJs.jpg,jKYVtU7G0IA
Moonshot,6.829,126,2022-05-05,0,"In a future where Mars is terraformed and colonized by the best humanity has to offer, two very different college students wind up joining forces and sneak onboard a space shuttle to the red planet in order to be united with their significant others.",/thqgzBPEDYQX0taszVus5nYMtTZ.jpg,o8sHjY9L-xw
Kiss of the Damned,5.071,126,2012-11-07,14752,"Beautiful vampire Djuna tries to resist the advances of the handsome, human screenwriter Paolo, but eventually gives in to their passion. When her seductive and highly volatile sister Mimi unexpectedly comes to visit, she threatens Djuna's new relationship, and the whole vampire community becomes endangered.",/oUrphKci0e2GyFaInyJLvr8Gbi3.jpg,Qk8kKHed20Q
House of D,6.26,125,2005-04-29,389866,"In the present, artist Tom Warshaw recalls his traumatic coming of age. As a 13-year-old growing up in New York City in 1973, Tom hangs out with Pappass, a mentally disabled man. With Tom's mother battling depression after the death of her husband, the young boy is left to his own devices. When Tom develops a crush on schoolmate Melissa, Pappass feels abandoned and begins behaving erratically.",/oVBMJQKHVTbXM8vEph3RhS4mKgr.jpg,zSL5WLdTT8s
Angry Video Game Nerd: The Movie,5.308,125,2014-07-21,0,"Based on the hit web series of the same name, the science fiction/adventure/comedy, Angry Video Game Nerd: The Movie, follows a disgruntled gamer who must overcome his fear of the worst video game of all time in order to save his fans. Hilarity ensues as a simple road trip becomes an extravagant pursuit of the unexpected.",/vXEKVaCbCUd53CYKkI0B7u1LBB6.jpg,4tfsQMoAg80
Boy Wonder,6.468,125,2010-08-11,0,"A young Brooklyn boy witnesses the brutal murder of his mother and grows up obsessed with finding her killer. Thus begins his life as a quiet, straight-A student by day and a self-appointed hero at night. But what is a real hero? And who decides what is right or wrong? As the boundaries blur, Sean's dual life wears on his psyche and his two worlds careen dangerously close to colliding. Like a graphic novel you can't put down, Boy Wonder challenges morality, distorting perceptions of what is right and what is justified, as it races to its shocking conclusion.",/kCbNgQDx4Y11N3M9b5aiEILbSZl.jpg,4HYhudl6nwM
Kit Kittredge: An American Girl,6.4,125,2008-07-02,17657973,"The Great Depression hits home for nine year old Kit Kittredge when her dad loses his business and leaves to find work. Oscar nominee Abigail Breslin stars as Kit, leading a splendid cast in the first ever ""American Girl"" theatrical movie. In order to keep their home, Kit and her mother must take in boarders - paying house - guests who turn out to be full of fascinating stories. When mother's lockbox containing all their money is stolen, Kit's new hobo friend Will is the prime suspect. Kit refuses to believe that Will would steal, and her efforts to sniff out the real story get her and friends into big trouble. The police say the robbery was an inside job, committed by someone they know. So if it wasn't Will, then who did it.",/niHi0hJSryO5DpSVNCMASc3EELc.jpg,F_tl7YF2tFc
Project Nim,6.812,125,2011-07-08,0,"From the team behind Man on Wire comes the story of Nim, the chimpanzee who in the 1970s became the focus of a landmark experiment which aimed to show that an ape could learn to communicate with language if raised and nurtured like a human child. Following Nim's extraordinary journey through human society, and the enduring impact he makes on the people he meets along the way, the film is an unflinching and unsentimental biography of an animal we tried to make human. What we learn about his true nature - and indeed our own - is comic, revealing and profoundly unsettling.",/bKvxfhFK4hSgY19ObJ30bQYtyli.jpg,yxQap9AAPOs
Good Boy!,5.609,124,2003-10-10,0,"An intergalactic dog pilot from Sirius (the dog star), visits Earth to verify the rumors that dogs have failed to take over the planet.",/kZDXSPfeKNtai6l8yE4J5LwVQMY.jpg,yWHrl0vEHDg
Pariah,6.821,124,2011-12-27,769552,"A Brooklyn teenager juggles conflicting identities and risks friendship, heartbreak, and family in a desperate search for sexual expression.",/lX9Ss9LH3bsAoGWDvsPv4zZG9fa.jpg,pNRdxsTmV1U
There Be Dragons,5.024,123,2011-03-25,0,"Arising out of the horror of the Spanish Civil War, a candidate for canonization is investigated by a journalist who discovers his own estranged father had a deep, dark and devastating connection to the saint's life.While researching the life of Josemaria Escriva, the controversial founder of Opus Dei, the young journalist Robert uncovers hidden stories of his estranged father Manolo, and is taken on a journey through the dark, terrible secrets of his family’s past.",/7y6ehxTLB1ZJl3xFVFbhcnoJx1m.jpg,z17OEqbrOOQ
Lola Versus,4.927,123,2012-04-24,252603,"Just three weeks before her wedding, Lola (Greta Gerwig) finds herself suddenly without a partner when her longtime fiance, Luke (Joel Kinnaman), dumps her. With her 30th birthday looming and being forced to re-enter the New York City dating scene, she feels adrift in a cold world. She leans on her friends (Zoe Lister-Jones, Hamish Linklater) for support but, after a series of romantic humiliations, professional blunders and boozy antics, Lola realizes that she alone is in charge of her fate.",/vAmofQjo2lECavOLlK72O3kFNc0.jpg,15kG87BW22Y
Mr Hublot,6.852,122,2013-10-14,0,"Mr Hublot is a withdrawn, idiosyncratic character with OCD, scared of change and the outside world. Robot Pet's arrival turns his life upside down: he has to share his home with this very invasive companion.",/cUDszLzmJ8SoB9ls4NyyTdfkdVY.jpg,b94E_6cJDCg
LEGO DC Comics Super Heroes: Justice League vs. Bizarro League,6.516,122,2015-02-10,0,"Superman’s clone, Bizarro, has become an embarrassing problem. Chaos and destruction follow Bizarro everywhere as he always hears the opposite of what is said, says the opposite of what he means and does the opposite of what is right. And when the citizens of Metropolis keep confusing Bizarro with Superman, the Man of Steel decides it’s time to find a new home for him…on another planet! It’s up to the Justice League to come to terms with their backward counterparts and team up with them to stop Darkseid and save the galaxy!",/bp0exZFHBLV0gWNXkBINtymOeom.jpg,o4zQYmowEVk
Bad Biology,4.631,122,2008-02-08,0,"Driven by biological excess, a young man and woman search for sexual fulfillment, unaware of each other's existence. Unfortunately, they eventually meet, and the bonding of these two very unusual human beings ends in an explosive and ultimately over-the-top sexual experience, resulting in a truly god awful love story....",/yIPDDjtCQv8MPEmTFOD1n9WGOB2.jpg,3qE7r6AXoAE
Disclosure,7.996,122,2020-06-19,0,"An investigation of how Hollywood's fabled stories have deeply influenced how Americans feel about transgender people, and how transgender people have been taught to feel about themselves.",/2MB2FPNxdSlykbH7ghBltoBYnTH.jpg,ih2-TLzLjgk
Grace Is Gone,6.4,122,2007-12-07,0,"Upon hearing his wife was killed in the Iraq war, a father takes his two daughters on a road trip, all the while searching for the right time and place to tell them about their mother's fate.",/tRRpa2YNkBTb8i36PmwnV6H8kyP.jpg,VidaeYteguA
