title,vote_average,vote_count,release_date,revenue,overview,poster_path,youtubeId
ParaNorman,6.963,2329,2012-08-03,107139399,"In the town of Blithe Hollow, Norman Babcock can speak to the dead, but no one other than his eccentric new friend believes his ability is real. One day, Norman's eccentric uncle tells him of a ritual he must perform to protect the town from a curse cast by a witch centuries ago.",/9DZPtuYTKYxt6vzHvZ5FLThG4fl.jpg,xwTBXDHIKYY
Inherent Vice,6.577,2314,2014-12-12,14710975,"In Los Angeles at the turn of the 1970s, drug-fueled detective Larry ""Doc"" Sportello investigates the disappearance of an ex-girlfriend.",/hyan5Uc0lGpPuad94DM1pLxneiP.jpg,BTRMkQzFYHI
S.W.A.T.,6.14,2304,2003-08-08,116643346,"Hondo Harrelson recruits Jim Street to join an elite unit of the Los Angeles Police Department. Together they seek out more members, including tough Deke Kay and single mom Chris Sanchez. The team's first big assignment is to escort crime boss Alex Montel to prison. It seems routine, but when Montel offers a huge reward to anyone who can break him free, criminals of various stripes step up for the prize.",/bon63yPVIgUFLP2653Dg9GCOJLJ.jpg,tLhMJFw5HVQ
Jobs,6.13,2300,2013-08-16,42100000,The story of Steve Jobs' ascension from college dropout into one of the most revered creative entrepreneurs of the 20th century.,/mOyZ0UAWaOJartFq2G3Cv0soFtQ.jpg,SH1jKZwcS9Y
Paul Blart: Mall Cop,5.407,2292,2009-01-15,183293131,"Mild-mannered Paul Blart has always had huge dreams of becoming a State Trooper. Until then, he patrols the local mall as a security guard. With his closely cropped moustache, personal transporter and gung-ho attitude, only Blart seems to take his job seriously. All that changes when a team of thugs raids the mall and takes hostages. Untrained, unarmed and a super-size target, Blart has to become a real cop to save the day.",/A4zZv0Q1VKURFZFEl2vwjaE2q0g.jpg,Ib4VZ1uvP6U
Bronson,6.994,2292,2008-10-09,2260712,"A young man who was sentenced to 7 years in prison for robbing a post office ends up spending 30 years in solitary confinement. During this time, his own personality is supplanted by his alter ego, Charles Bronson.",/o5JaAtcvjRJz3utEaptk0L77FjM.jpg,paa9knyJKrs
Dogma,6.906,2289,1999-11-12,31429330,"The latest battle in the eternal war between Good and Evil has come to New Jersey in the late, late 20th Century. Angels, demons, apostles and prophets (of a sort) walk among the cynics and innocents of America and duke it out for the fate of humankind.",/xI5beD8Td79E2uZNAxgd1gWWOEd.jpg,20CRw3XdETA
Suspiria,6.936,2280,2018-10-11,6348889,"Young American dancer Susie Bannion arrives in 1970s Berlin to audition for the world-renowned Helena Markos Dance Company. When she vaults to the role of lead dancer, the woman she replaces breaks down and accuses the company's female directors of witchcraft. Meanwhile, an inquisitive psychotherapist and a member of the troupe uncover dark and sinister secrets as they probe the depths of the studio's hidden underground chambers.",/dzWTnkert9EoiPWldWJ15dnfAFl.jpg,8HDrmdveRE0
Eat Pray Love,6.231,2272,2010-08-12,204594016,"Liz Gilbert had everything a modern woman is supposed to dream of having – a husband, a house and a successful career – yet like so many others, she found herself lost, confused and searching for what she really wanted in life. Newly divorced and at a crossroads, Gilbert steps out of her comfort zone, risking everything to change her life, embarking on a journey around the world that becomes a quest for self-discovery. In her travels, she discovers the true pleasure of nourishment by eating in Italy, the power of prayer in India and, finally and unexpectedly, the inner peace and balance of true love in Bali.",/9Hgiv1UEIjc8VwtOmFBCFzMs0er.jpg,g8csr68LjUM
Clerks,7.418,2264,1994-10-19,3151130,"Convenience and video store clerks Dante and Randal are sharp-witted, potty-mouthed and bored out of their minds. So in between needling customers, the counter jockeys play hockey on the roof, visit a funeral home and deal with their love lives.",/zeFhNF0SXlYIvWXpaOLuXVQ3jB4.jpg,Mlfn5n-E2WE
J. Edgar,6.21,2262,2011-11-09,84606030,"As the face of law enforcement in the United States for almost 50 years, J. Edgar Hoover was feared and admired, reviled and revered. But behind closed doors, he held secrets that would have destroyed his image, his career, and his life.",/hWHFPhGvCvfHbZCxJSR3n6GsXIf.jpg,vD99zwj-ZUg
Surf's Up,6.386,2260,2007-06-08,149044513,"A young surfer enters his first contest, hoping a win will earn him respect. But an encounter with a laid-back local forces him to rethink his values.",/tTDsCVlDA8QR4Dc6t6nERfwl5z.jpg,N41QJ0VCs68
Paranormal Activity 2,5.75,2259,2010-10-20,177512032,"Days after welcoming a newborn baby, Dan and Kristi Rey return home one day to find their house ransacked with seemingly no explanation. Their fear forces them to put in security cameras, which begin to capture strange activity around the house.",/gfdrkBZAyUUXJJ2iLQe03SAYRD3.jpg,07XbSk7Rjt4
Midway,7.155,2254,2019-11-06,127420861,"The story of the Battle of Midway, and the leaders and soldiers who used their instincts, fortitude and bravery to overcome massive odds.",/hj8pyoNnynGeJTAbl7jcLZO8Uhx.jpg,WjofsqGsDvY
Season of the Witch,5.428,2254,2011-01-07,91627228,"A 14th century Crusader returns with his comrade to a homeland devastated by the Black Plague. The Church commands the two knights to transport a witch to a remote abbey, where monks will perform a ritual in hopes of ending the pestilence.",/6jyHkHpNwy8qjxhc5vJsmqVCl3J.jpg,YHR56TdWC44
Babylon,7.443,2244,2022-12-22,63363579,"A tale of outsized ambition and outrageous excess, tracing the rise and fall of multiple characters in an era of unbridled decadence and depravity during Hollywood's transition from silent films and to sound films in the late 1920s.",/wjOHjWCUE0YzDiEzKv8AfqHj3ir.jpg,u0nhcK_bylU
Run,7.336,2240,2020-11-20,5184368,"Chloe, a teenager who is confined to a wheelchair, is homeschooled by her mother, Diane. Chloe soon becomes suspicious of her mother and begins to suspect that she may be harboring a dark secret.",/ilHG4EayOVoYeKqslspY3pR4wzC.jpg,C1QhIvsUP_o
Elektra,5.024,2231,2005-01-13,56681566,"Elektra the warrior survives a near-death experience, becomes an assassin-for-hire, and tries to protect her two latest targets, a single father and his young daughter, from a group of supernatural assassins.",/9Azi1GBNj3gPPwmQWAMcATg7JOl.jpg,etfIjKxKzqw
Stuart Little 2,5.748,2226,2002-07-19,169956806,"Stuart, an adorable white mouse, still lives happily with his adoptive family, the Littles, on the east side of Manhattan's Central Park. More crazy mouse adventures are in store as Stuart, his human brother, George, and their mischievous cat, Snowbell, set out to rescue a friend.",/iloXmNMrOtZoKfbTkHoBLXtpYNz.jpg,HvdNtZ5zPTs
Deep Blue Sea,5.955,2223,1999-07-28,164648142,"Researchers on the undersea lab Aquatica have genetically altered the brains of captive sharks to develop a cure for Alzheimer's disease. But there's an unexpected side effect: the sharks got smarter, faster, and more dangerous. After a big storm damages their remote research facility, they must fight for their lives.",/fyn0zyCI4kIlbDoHH0Hzv09hDC5.jpg,gpdab_bi2HY
"Definitely, Maybe",6.906,2220,2008-02-08,55447968,"When Will decides to tell his daughter the story of how he met her mother, he discovers that a second look at the past might also give him a second chance at the future.",/2b70ZgWRhEibCHppQkb9tTxahGr.jpg,LMpLWf5tv30
It's Kind of a Funny Story,6.982,2205,2010-10-08,6491240,A clinically depressed teenager gets a new start after he checks himself into an adult psychiatric ward.,/hQE4q8Szeaae4davgB7o8MTLmwr.jpg,P_pq7HKc9z8
Dirty Harry,7.461,2201,1971-12-22,35976000,"When a madman dubbed 'Scorpio' terrorizes San Francisco, hard-nosed cop, Harry Callahan – famous for his take-no-prisoners approach to law enforcement – is tasked with hunting down the psychopath. Harry eventually collars Scorpio in the process of rescuing a kidnap victim, only to see him walk on technicalities. Now, the maverick detective is determined to nail the maniac himself.",/4PFF5FImrRQjeAuOP8NsCqUCEe5.jpg,K6Vi1VurN9s
Hustle,7.787,2197,2022-06-03,0,"After discovering a once-in-a-lifetime player with a rocky past abroad, a down on his luck basketball scout takes it upon himself to bring the phenom to the States without his team's approval. Against the odds, they have one final shot to prove they have what it takes to make it in the NBA.",/xWic7kPq13oRxYjbGLApXCnc7pz.jpg,J2UiuaD8B_0
Gamer,5.7,2195,2009-09-03,40828540,"Mind-control technology has taken society by a storm, a multiplayer on-line game called ""Slayers"" allows players to control human prisoners in mass-scale. Simon controls Kable, the online champion of the game. Kable's ultimate challenge becomes regaining his identity and independence by defeating the game's mastermind.",/rfQtqLHeisaQ4HlYtNremtUl9oP.jpg,P2g94xQmtHw
Zack and Miri Make a Porno,6.302,2189,2008-09-18,42105111,"Lifelong platonic friends Zack and Miri look to solve their respective cash-flow problems by making an adult film together. As the cameras roll, however, the duo begin to sense that they may have more feelings for each other than they previously thought.",/40qxr2p2s297Q1mWFJOsRatQPK0.jpg,OssgMY_mkMc
Perfect Blue,8.287,2175,1998-02-28,112536,"Pop singer Mima Kirigow looks forward to a bright new career when she quits her chart-topping trio to become an actress. When she lands a role in a sexually charged murder mystery, Mima’s life begins to fall apart.",/bee6ZQVaSAUhlBinsP9In8x8vO1.jpg,eN_XcMuvOz0
K-PAX,7.186,2168,2001-10-22,50315140,"Prot is a patient at a mental hospital who claims to be from a far away planet. His psychiatrist tries to help him, only to begin to doubt his own explanations.",/zHkZBcZvB89CblAY6wViAK9Sryf.jpg,YV5s07zI-Bg
Pandorum,6.559,2160,2009-09-08,20648328,"Two crew members wake up on an abandoned spacecraft with no idea who they are, how long they've been asleep, or what their mission is. The two soon discover they're actually not alone – and the reality of their situation is more horrifying than they could have imagined.",/tgnKTUsKJ6kM0oqiLmPNePgQ8Sw.jpg,PItZ-qr9jG8
Before Midnight,7.513,2158,2013-04-05,11176469,"It has been nine years since we last met Jesse and Celine, the French-American couple who once met on a train in Vienna. Now, live in Paris with twin daughters, but have spent a summer in Greece on the invitation of an author colleague of Jesse's. When the vacation is over and Jesse must send his teenage son off to the States, he begins to question his life decisions, and his relationship with Celine is at risk.",/qbGKJmNUroDz75kh5Oafoall89e.jpg,Kv6JWoVKlGY
Ghosts of Girlfriends Past,5.954,2158,2009-05-01,102223269,"When notorious womanizer Connor Mead attends his brother Paul's wedding, he is forced to re-evaluate his behavior as he comes face-to-face with the ghosts of girlfriends past, present, and future, along with his deceased uncle. The experience changes his attitude and allows him to reconnect with his first and only love, Jenny.",/yNn5NjNQF8m7w05Jqk2kEW2XOfU.jpg,HqlxWZNeWNk
Beverly Hills Cop II,6.47,2149,1987-05-18,299965036,"Axel heads for the land of sunshine and palm trees to find out who shot police Captain Andrew Bogomil. Thanks to a couple of old friends, Axel's investigation uncovers a series of robberies masterminded by a heartless weapons kingpin—and the chase is on.",/egDakU8O5yUwpUJP9IMAUVtIDll.jpg,vbOcCgCqrwQ
Flatliners,5.7,2147,2017-09-28,45158254,"Five medical students, hoping to understand the mystery of what lies beyond life, embark on a dangerous experiment. When their hearts are stopped for a short period of time, they have a near-death experience…",/e9NHATN0TJW6ZZPLLWFsKdilVl1.jpg,U8rTNnk8ROM
Never Back Down,6.746,2146,2008-03-04,41627431,"Jake, full of anger after his father's death, is just starting to find a place for himself at his new Orlando high school - until Ryan, head of an underground MMA fight club, picks Jake out as a prime opponent. After being trounced by Ryan in front of the entire school, Jake begins training under the firm, moral guidance of a MMA master, where he learns how to fight... and how to avoid a fight. But it becomes obvious that a rematch will be inevitable if Jake wants to stop Ryan and his bullying, once and for all.",/8oRUTyP1QAtGDMvRpKZyuyFPG0U.jpg,2tc-RPjZRm8
Legend of the Guardians: The Owls of Ga'Hoole,6.8,2143,2010-07-10,140073390,"Soren, a young barn owl, is kidnapped by owls of St. Aggie's, ostensibly an orphanage, where owlets are brainwashed into becoming soldiers. He and his new friends escape to the island of Ga'Hoole, to assist its noble, wise owls who fight the army being created by the wicked rulers of St. Aggie's. The film is based on the first three books in the series.",/zKY2nJPozrItOsSCkjgY7QPkLrE.jpg,huRnGh-NWGM
Widows,6.5,2143,2018-11-06,73866088,"A police shootout leaves four thieves dead during an explosive armed robbery attempt in Chicago. Their widows have nothing in common except a debt left behind by their spouses' criminal activities. Hoping to forge a future on their own terms, they join forces to pull off a heist.",/d31SGJSaX29ba5ZUbZcesGoDE7I.jpg,62vUltKnN2Y
Foxcatcher,6.656,2129,2014-11-14,12096300,The greatest Olympic Wrestling Champion brother team joins Team Foxcatcher led by multimillionaire sponsor John E. du Pont as they train for the 1988 games in Seoul - a union that leads to unlikely circumstances.,/w6Sl079QtUcQ9dVQ2RP6aN9NBXx.jpg,p294aQbxkQE
Sky High,6.236,2125,2005-07-29,86369815,"Set in a world where superheroes are commonly known and accepted, young Will Stronghold, the son of the Commander and Jetstream, tries to find a balance between being a normal teenager and an extraordinary being.",/oK54M9VKOCLR1u0j26ttRix0G18.jpg,5beKfbM9uGg
Point Break,5.921,2125,2015-12-03,133718711,"A young undercover FBI agent infiltrates a gang of thieves who share a common interest in extreme sports. A remake of the 1991 film, ""Point Break"".",/z7JOvw5Lqs9ezoFTJxmz3nx3av2.jpg,UsbuQ-jg014
Wild Hogs,5.942,2116,2007-03-02,253625427,"Restless and ready for an adventure, four suburban bikers leave the safety of their subdivision and head out on the open road. But complications ensue when they cross paths with an intimidating band of New Mexico bikers known as the Del Fuegos.",/qYyPCZcpNGZwbyBo1gwdCiW5hHC.jpg,sioVHR09ggQ
Every Day,7.229,2112,2018-02-22,10421847,"16-year old Rhiannon falls in love with a mysterious spirit named “A” that inhabits a different body every day. Feeling an unmatched connection, Rhiannon and “A” work each day to find each other, not knowing what the next day will bring.",/4UnME3icxSspwL0UoGZNSyyp7Xs.jpg,vLO1GFEvIIE
Never Let Me Go,6.856,2111,2010-03-18,9918093,"As children, Kathy, Ruth, and Tommy spend their childhood at an idyllic and secluded English boarding school. As they grow into adults, they must come to terms with the complexity and strength of their love for one another while also preparing for the haunting reality awaiting them.",/8F0r5ng9Fp60OhzQfR5v33fppq.jpg,sXiRZhDEo8A
Push,6.148,2110,2009-02-04,49678401,"After his father, an assassin, is brutally murdered, Nick Gant vows revenge on Division, the covert government agency that dabbles in psychic warfare and experimental drugs. Hiding in Hong Kong's underworld, Nick assembles a band of rogue psychics dedicated to destroying Division. Together with Cassie, a teenage clairvoyant, Nick goes in search of a missing girl and a stolen suitcase that could be the key to accomplishing their mutual goal.",/fHStfRjQGstuqtUz4Q22lbFU58M.jpg,afT1fAwSr-Q
Burlesque,7.187,2109,2010-11-23,89519773,"Ali leaves behind a troubled life and follows her dreams to Los Angeles, where she lands a job as a cocktail waitress at the Burlesque Lounge, a once-majestic theater that houses an inspired musical revue. Vowing to perform there, she makes the leap from bar to stage, helping restore the club's former glory.",/3U9zBIibERQZqYKM3N1a4MYgBsN.jpg,1PiPYAz7f0Q
Norbit,5.584,2100,2007-02-08,159313561,"A mild-mannered guy who is engaged to a monstrous woman meets the woman of his dreams, and schemes to find a way to be with her.",/adBqvVwyzHgDzZJnNCqe8RWImxV.jpg,MmSZJ17ppEQ
Gothika,6.077,2098,2003-11-21,141591324,"After a car crash, a criminal psychologist regains consciousness only to find that she's a patient in the same mental institution that currently employs her. It seems she's been accused of murdering her husband—but she has no memory of committing the crime. As she tries to regain her memory and convince her co-workers of her innocence, a vengeful spirit uses her as an earthly pawn, which further convinces everyone of her guilt.",/frSGNQcWx1ek8dCduFYCux1ho7n.jpg,IjYKXr9w0QI
Case 39,6.29,2085,2009-08-13,29000000,"In her many years as a social worker, Emily Jenkins believes she has seen it all, until she meets 10-year-old Lilith and the girl's cruel parents. Emily's worst fears are confirmed when the parents try to harm the child, and so Emily assumes custody of Lilith while she looks for a foster family. However, Emily soon finds that dark forces surround the seemingly innocent girl, and the more she tries to protect Lilith, the more horrors she encounters.",/b16EjFeHd2AwoYXWUne7DA346pU.jpg,oTXOxLI0kVQ
Selma,7.402,2084,2014-12-25,66787908,"""Selma,"" as in Alabama, the place where segregation in the South was at its worst, leading to a march that ended in violence, forcing a famous statement by President Lyndon B. Johnson that ultimately led to the signing of the Voting Rights Act.",/wq4lhMc4BuOyQqe1ZGzhxLyy3Uk.jpg,x6t7vVTxaic
Pete's Dragon,6.379,2080,2016-08-10,143695338,"For years, old wood carver Mr. Meacham has delighted local children with his tales of the fierce dragon that resides deep in the woods of the Pacific Northwest. To his daughter, Grace, who works as a forest ranger, these stories are little more than tall tales... until she meets Pete, a mysterious 10-year-old with no family and no home who claims to live in the woods with a giant, green dragon named Elliott. And from Pete's descriptions, Elliott seems remarkably similar to the dragon from Mr. Meacham's stories. With the help of Natalie, an 11-year-old girl whose father Jack owns the local lumber mill, Grace sets out to determine where Pete came from, where he belongs, and the truth about this dragon.",/A9x4Ogk8KUXTfU649NS6lS9TCmu.jpg,vUW0a_I3kxU
Stoker,6.659,2078,2013-02-28,12077441,"After India's father dies, her Uncle Charlie, who she never knew existed, comes to live with her and her unstable mother. She comes to suspect this mysterious, charming man has ulterior motives and becomes increasingly infatuated with him.",/o0giW5oasaef5m9sgBuq0C7IkIa.jpg,YuhpCPtSgas
Thunderball,6.644,2077,1965-12-11,141195658,A criminal organization has obtained two nuclear bombs and are asking for a 100 million pound ransom in the form of diamonds in seven days or they will use the weapons. The secret service sends James Bond to the Bahamas to once again save the world.,/kQdyq96yvqrPCkLdaiucsE92neO.jpg,sINW75t3g_U
Superman II,6.731,2069,1980-12-04,190458706,"Three escaped criminals from the planet Krypton test the Man of Steel's mettle. Led by General Zod, the Kryptonians take control of the White House and partner with Lex Luthor to destroy Superman and rule the world. But Superman, who attempts to make himself human in order to get closer to Lois, realizes he has a responsibility to save the planet.",/jw0tYFCbzjBN8SIhvRC2kdh7pzh.jpg,btUYgD1EdpM
Tron,6.668,2066,1982-07-09,33000000,"When brilliant video game maker Flynn hacks the mainframe of his ex-employer, he is beamed inside an astonishing digital world...and becomes part of the very game he is designing. In his mission through cyberspace, Flynn matches wits with a maniacal Master Control Program and teams up with Tron, a security measure created to bring balance to the digital environment.",/zwSFEczP7AzqugAHHIX3zHniT0t.jpg,1fSUos8x73I
Ip Man 2,7.5,2058,2010-04-29,36000000,"Having defeated the best fighters of the Imperial Japanese army in occupied Shanghai, Ip Man and his family settle in post-war Hong Kong. Struggling to make a living, Master Ip opens a kung fu school to bring his celebrated art of Wing Chun to the troubled youth of Hong Kong. His growing reputation soon brings challenges from powerful enemies, including pre-eminent Hung Gar master, Hung Quan.",/yB5v6wRhIoZxlDvCFFCQhUNezDY.jpg,gaBdgu00otE
About a Boy,6.654,2054,2002-04-26,129000000,"Will Freeman is a good-looking, smooth-talking bachelor whose primary goal in life is avoiding any kind of responsibility. But when he invents an imaginary son in order to meet attractive single moms, Will gets a hilarious lesson about life from a bright, but hopelessly geeky 12-year-old named Marcus. Now, as Will struggles to teach Marcus the art of being cool, Marcus teaches Will that you're never too old to grow up.",/qoZ1bD0q9EFqcNiEYbEigsRcNCt.jpg,FzYVvwwNwUM
I Spit on Your Grave,6.5,2053,2010-06-17,572809,"Jennifer is a writer working on a new novel and, needing to get out of the city to finish it, hires a riverside apartment in upstate New York to finish her book—attracting the attention of a number of rowdy male locals.",/4VZ9eqel8Fsp54KMnesr3xIc67N.jpg,oOxSvFKrHew
Splice,5.828,2043,2009-10-06,0,"Elsa and Clive, two young rebellious scientists, defy legal and ethical boundaries and forge ahead with a dangerous experiment: splicing together human and animal DNA to create a new organism. Named ""Dren"", the creature rapidly develops from a deformed female infant into a beautiful but dangerous winged human-chimera, who forges a bond with both of her creators - only to have that bond turn deadly.",/4oqaWnO3dKYAt3vZWAD4oLfOXOC.jpg,lDB7bnl7nQQ
Paranormal Activity 3,5.901,2031,2011-10-19,207039844,"In 1988, young sisters Katie and Kristi befriend an invisible entity who resides in their home.",/9nYranPiWdNmbD5PRPPSL7VUFTS.jpg,GuPCP7yzqc8
Green Zone,6.456,2019,2010-03-11,94882889,"During the U.S.-led occupation of Baghdad in 2003, Chief Warrant Officer Roy Miller and his team of Army inspectors are dispatched to find weapons of mass destruction believed to be stockpiled in the Iraqi desert. Rocketing from one booby-trapped and treacherous site to the next, the men search for deadly chemical agents but stumble instead upon an elaborate cover-up that threatens to invert the purpose of their mission.",/czFIaeukSxNEccysQeys1PCkuOG.jpg,e3KJ21TLKVE
This Is 40,5.861,2010,2012-12-20,88215156,"Pete and Debbie are both about to turn 40, their kids hate each other, both of their businesses are failing, they're on the verge of losing their house, and their relationship is threatening to fall apart.",/mzUuOIFoVkRTHACRb58vm6mkbBN.jpg,gxkNuHrS6cg
Freedom Writers,7.911,2007,2007-01-05,43095175,"A young teacher inspires her class of at-risk students to learn tolerance, apply themselves, and pursue education beyond high school.",/81AdeUQT99N0xPg3j6RVh0YGOTk.jpg,MT0L1U-Rdj4
Adventureland,6.39,2004,2009-04-03,17164820,"In the summer of 1987, a college graduate takes a 'nowhere' job at his local amusement park, only to find it's the perfect course to get him prepared for the real world.",/eeSJNAR1aWcgANq26KWIHm3cbyB.jpg,4F--nHysJkw
Cinderella Man,7.531,1990,2005-06-02,108539911,"The true story of boxer Jim Braddock who, following his retirement in the 1920s, makes a surprise comeback in order to lift his family out of poverty.",/i7OYyyAB2pSW9YwK0M2swDz6xSc.jpg,DlbHzcH4VJY
Sex and the City,6.56,1979,2008-05-12,418765519,A New York writer on sex and love is finally getting married to her Mr. Big. But her three best girlfriends must console her after one of them inadvertently leads Mr. Big to jilt her.,/AhNfnsGW95RKHQNLdgFH48UN0Zy.jpg,ZaaLsOyUm_Q
Inkheart,6.277,1976,2008-12-11,62803180,"The adventures of a father and his young daughter, in their search for a long lost book that will help reunite a missing, close relative.",/jqvhxcowBfckO8RWtaMMVc4QFeB.jpg,EsV2Z_il_L4
Killing Them Softly,6.049,1975,2012-07-30,37930465,"Jackie Cogan is an enforcer hired to restore order after three dumb guys rob a Mob protected card game, causing the local criminal economy to collapse.",/heaz45kpFa4Oa7iLis0OBas68ls.jpg,oJGfnSm7dHs
Poseidon,5.841,1966,2006-05-10,181674817,"A packed cruise ship traveling the Atlantic is hit and overturned by a massive wave, compelling the passengers to begin a dramatic fight for their lives.",/1ma5b9XLCziCHzQP0Zy1Y1PqNyM.jpg,PLcLUEE2pyY
You Only Live Twice,6.557,1959,1967-06-13,111584787,A mysterious spacecraft captures Russian and American space capsules and brings the two superpowers to the brink of war. James Bond investigates the case in Japan and comes face to face with his archenemy Blofeld.,/fdRbvRcEXcf2rC4ghLFZzCWPSmB.jpg,Ovp7MN4tG54
Primer,6.792,1958,2004-10-08,545436,"Friends and fledgling entrepreneurs invent a device in their garage which reduces the apparent mass of any object placed inside it, but they discover that it has some highly unexpected capabilities - ones that could enable them to do and to have seemingly anything they want. Taking advantage of this unique opportunity is the first challenge they face. Dealing with the consequences is the next.",/xEoq2WmDzpzxhkHEsmOYOg6BPg6.jpg,fqx32xkATrY
City Lights,8.306,1957,1931-02-01,4250000,"In this sound-era silent film, a tramp falls in love with a beautiful blind flower seller.",/bXNvzjULc9jrOVhGfjcc64uKZmZ.jpg,X_W1tOngo-w
The Boy Next Door,4.869,1955,2015-01-23,52425855,"A recently cheated on married woman falls for a younger man who has moved in next door, but their torrid affair soon takes a dangerous turn.",/tM0hpWw3GONam6TKcMMciecHjhT.jpg,MgbBwovOOoc
